[
  {
    "id": "aws_beginner_mcq_001",
    "domain": "AWS",
    "level": "Beginner",
    "type": "mcq",
    "difficulty": "easy",
    "concept": "S3 data lake storage",
    "question": "Which AWS service is most commonly used as durable object storage for a data lake?",
    "options": ["Amazon S3", "Amazon EC2", "Amazon RDS", "Amazon CloudWatch"],
    "correct_answer": "Amazon S3",
    "explanation": "Amazon S3 stores objects durably and is commonly used as the landing, raw, curated, and archive storage layer in AWS data lakes.",
    "ideal_answer": "Amazon S3 is commonly used for data lakes because it provides durable, scalable object storage for files such as CSV, JSON, and Parquet.",
    "tags": ["aws", "s3", "data_lake", "basics"]
  },
  {
    "id": "aws_beginner_mcq_002",
    "domain": "AWS",
    "level": "Beginner",
    "type": "mcq",
    "difficulty": "easy",
    "concept": "IAM least privilege",
    "question": "What is the main purpose of IAM in an AWS data platform?",
    "options": ["Control who can access AWS resources", "Compress Parquet files", "Schedule SQL queries", "Store dashboard images"],
    "correct_answer": "Control who can access AWS resources",
    "explanation": "IAM manages identities, roles, policies, and permissions so users and services can access only the resources they need.",
    "ideal_answer": "IAM controls access to AWS resources. In a data platform, it should be configured with least privilege for users, roles, and service accounts.",
    "tags": ["aws", "iam", "security", "least_privilege"]
  },
  {
    "id": "aws_beginner_fill_003",
    "domain": "AWS",
    "level": "Beginner",
    "type": "fill_blank",
    "difficulty": "easy",
    "concept": "AWS Glue",
    "question": "Fill in the blank: AWS ____ is commonly used for serverless ETL jobs and metadata cataloging.",
    "correct_answer": "Glue",
    "acceptable_answers": ["glue", "AWS Glue", "Glue"],
    "explanation": "AWS Glue provides managed ETL capabilities and also includes the Glue Data Catalog for table metadata.",
    "ideal_answer": "AWS Glue is used for serverless ETL and metadata management through the Glue Data Catalog.",
    "tags": ["aws", "glue", "etl", "catalog"]
  },
  {
    "id": "aws_beginner_match_004",
    "domain": "AWS",
    "level": "Beginner",
    "type": "match",
    "difficulty": "easy",
    "concept": "Core AWS data services",
    "question": "Match each AWS service to its common data engineering use.",
    "left_items": ["S3", "Glue", "Athena"],
    "right_items": ["Object storage", "Serverless ETL and catalog", "Query files with SQL"],
    "correct_pairs": {"S3": "Object storage", "Glue": "Serverless ETL and catalog", "Athena": "Query files with SQL"},
    "explanation": "S3 stores data, Glue prepares and catalogs data, and Athena queries data in S3 using SQL.",
    "ideal_answer": "S3 is object storage, Glue handles ETL and catalog metadata, and Athena runs SQL over data in S3.",
    "tags": ["aws", "s3", "glue", "athena"]
  },
  {
    "id": "aws_beginner_mcq_005",
    "domain": "AWS",
    "level": "Beginner",
    "type": "mcq",
    "difficulty": "easy",
    "concept": "Athena query engine",
    "question": "What does Amazon Athena allow a data engineer to do?",
    "options": ["Run SQL queries directly on data in S3", "Replace IAM policies", "Provision EC2 networking", "Send mobile notifications only"],
    "correct_answer": "Run SQL queries directly on data in S3",
    "explanation": "Athena is a serverless SQL query service commonly used to query files in S3 through table metadata in the Glue Data Catalog.",
    "ideal_answer": "Athena lets you run SQL over data stored in S3, usually using schemas registered in the Glue Data Catalog.",
    "tags": ["aws", "athena", "sql", "s3"]
  },
  {
    "id": "aws_beginner_fill_006",
    "domain": "AWS",
    "level": "Beginner",
    "type": "fill_blank",
    "difficulty": "easy",
    "concept": "Columnar file formats",
    "question": "Fill in the blank: ____ is a columnar file format often preferred for analytical queries on S3.",
    "correct_answer": "Parquet",
    "acceptable_answers": ["parquet", "Apache Parquet", "Parquet"],
    "explanation": "Parquet stores data by column, which can reduce scan size and improve performance for analytical workloads.",
    "ideal_answer": "Parquet is commonly preferred for analytics because it is columnar, compressed, and works well with Athena, Glue, Spark, and Redshift Spectrum.",
    "tags": ["aws", "parquet", "file_formats", "analytics"]
  },
  {
    "id": "aws_beginner_match_007",
    "domain": "AWS",
    "level": "Beginner",
    "type": "match",
    "difficulty": "easy",
    "concept": "AWS messaging basics",
    "question": "Match each messaging service to its basic pattern.",
    "left_items": ["SQS", "SNS", "Kinesis"],
    "right_items": ["Queue for decoupling workers", "Publish-subscribe notifications", "Streaming event ingestion"],
    "correct_pairs": {"SQS": "Queue for decoupling workers", "SNS": "Publish-subscribe notifications", "Kinesis": "Streaming event ingestion"},
    "explanation": "SQS queues messages, SNS fans out notifications, and Kinesis handles ordered streaming data.",
    "ideal_answer": "SQS is a queue, SNS is pub-sub fanout, and Kinesis is used for streaming event ingestion.",
    "tags": ["aws", "sqs", "sns", "kinesis", "messaging"]
  },
  {
    "id": "aws_beginner_mcq_008",
    "domain": "AWS",
    "level": "Beginner",
    "type": "mcq",
    "difficulty": "easy",
    "concept": "CloudWatch monitoring",
    "question": "Which AWS service is commonly used to view logs, metrics, and alarms for data platform workloads?",
    "options": ["Amazon CloudWatch", "AWS Glue Data Catalog", "Amazon S3 Glacier", "AWS IAM Access Analyzer only"],
    "correct_answer": "Amazon CloudWatch",
    "explanation": "CloudWatch collects logs, metrics, events, and alarms for many AWS services and custom workloads.",
    "ideal_answer": "CloudWatch is used to monitor logs, metrics, and alarms for jobs, pipelines, Lambda functions, Glue jobs, and other AWS workloads.",
    "tags": ["aws", "cloudwatch", "monitoring", "operations"]
  },
  {
    "id": "aws_beginner_fill_009",
    "domain": "AWS",
    "level": "Beginner",
    "type": "fill_blank",
    "difficulty": "easy",
    "concept": "Glue Data Catalog",
    "question": "Fill in the blank: The Glue Data ____ stores table metadata used by services like Athena.",
    "correct_answer": "Catalog",
    "acceptable_answers": ["catalog", "Catalog", "data catalog", "Glue Data Catalog"],
    "explanation": "The Glue Data Catalog stores databases, tables, schemas, partitions, and metadata that query engines can use.",
    "ideal_answer": "The Glue Data Catalog stores metadata such as databases, tables, schemas, and partitions so services like Athena can query data in S3.",
    "tags": ["aws", "glue_data_catalog", "metadata", "athena"]
  },
  {
    "id": "aws_beginner_match_010",
    "domain": "AWS",
    "level": "Beginner",
    "type": "match",
    "difficulty": "easy",
    "concept": "Storage zones",
    "question": "Match each data lake zone to its usual purpose.",
    "left_items": ["Raw zone", "Curated zone", "Archive zone"],
    "right_items": ["Stores source-like data", "Stores cleaned analytics-ready data", "Stores older retained data"],
    "correct_pairs": {"Raw zone": "Stores source-like data", "Curated zone": "Stores cleaned analytics-ready data", "Archive zone": "Stores older retained data"},
    "explanation": "S3 data lakes often separate raw, curated, and archive data to improve governance and processing clarity.",
    "ideal_answer": "A raw zone keeps source-like data, a curated zone stores cleaned trusted data, and an archive zone keeps older data for retention or recovery.",
    "tags": ["aws", "s3", "data_lake", "zones"]
  }
]
