[
  {
    "id": "production_engineering_beginner_mcq_001",
    "domain": "Production Engineering",
    "level": "Beginner",
    "type": "mcq",
    "difficulty": "easy",
    "concept": "Monitoring",
    "question": "What is the main purpose of monitoring a data pipeline?",
    "options": ["To detect whether the pipeline is healthy or failing", "To rename all tables automatically", "To remove the need for testing", "To make every query free"],
    "correct_answer": "To detect whether the pipeline is healthy or failing",
    "explanation": "Monitoring gives visibility into pipeline health, failures, latency, freshness, and resource usage.",
    "ideal_answer": "Monitoring helps detect whether a data pipeline is running successfully, meeting freshness expectations, and producing reliable outputs.",
    "tags": ["production_engineering", "monitoring", "pipelines", "basics"]
  },
  {
    "id": "production_engineering_beginner_mcq_002",
    "domain": "Production Engineering",
    "level": "Beginner",
    "type": "mcq",
    "difficulty": "easy",
    "concept": "Alerting",
    "question": "What should an alert usually indicate?",
    "options": ["A condition that needs attention or action", "A normal dashboard color", "A random log line", "A table description"],
    "correct_answer": "A condition that needs attention or action",
    "explanation": "Good alerts point to actionable conditions such as failed jobs, stale data, missed SLAs, or high error rates.",
    "ideal_answer": "An alert should notify the right owner about an actionable production condition that may need investigation or response.",
    "tags": ["production_engineering", "alerting", "operations", "basics"]
  },
  {
    "id": "production_engineering_beginner_fill_003",
    "domain": "Production Engineering",
    "level": "Beginner",
    "type": "fill_blank",
    "difficulty": "easy",
    "concept": "Logging",
    "question": "Fill in the blank: Application ____ help engineers understand what happened during a pipeline run.",
    "correct_answer": "logs",
    "acceptable_answers": ["logs", "logging", "log"],
    "explanation": "Logs capture events, errors, and context from applications and jobs so failures can be investigated.",
    "ideal_answer": "Logs help engineers understand the sequence of events, errors, and context during a pipeline run.",
    "tags": ["production_engineering", "logging", "troubleshooting", "basics"]
  },
  {
    "id": "production_engineering_beginner_match_004",
    "domain": "Production Engineering",
    "level": "Beginner",
    "type": "match",
    "difficulty": "easy",
    "concept": "Observability signals",
    "question": "Match each observability signal to what it usually shows.",
    "left_items": ["Metrics", "Logs", "Traces"],
    "right_items": ["Numeric measurements over time", "Detailed event records", "Request or workflow path"],
    "correct_pairs": {"Metrics": "Numeric measurements over time", "Logs": "Detailed event records", "Traces": "Request or workflow path"},
    "explanation": "Metrics, logs, and traces give complementary views into system behavior.",
    "ideal_answer": "Metrics show numeric trends, logs show detailed events, and traces show how a request or workflow moved through systems.",
    "tags": ["production_engineering", "observability", "metrics", "logs", "traces"]
  },
  {
    "id": "production_engineering_beginner_mcq_005",
    "domain": "Production Engineering",
    "level": "Beginner",
    "type": "mcq",
    "difficulty": "easy",
    "concept": "Dashboard",
    "question": "What is a production dashboard useful for?",
    "options": ["Viewing important operational signals in one place", "Replacing all alerts", "Changing source data manually", "Deleting old incidents"],
    "correct_answer": "Viewing important operational signals in one place",
    "explanation": "Dashboards help teams observe trends, failures, freshness, volume, latency, and other operational indicators.",
    "ideal_answer": "A dashboard centralizes important metrics like job status, freshness, failures, latency, volume, and cost so teams can understand platform health.",
    "tags": ["production_engineering", "dashboards", "monitoring", "operations"]
  },
  {
    "id": "production_engineering_beginner_fill_006",
    "domain": "Production Engineering",
    "level": "Beginner",
    "type": "fill_blank",
    "difficulty": "easy",
    "concept": "Incident management",
    "question": "Fill in the blank: An ____ is an unplanned event that disrupts or risks disrupting a service.",
    "correct_answer": "incident",
    "acceptable_answers": ["incident", "production incident", "outage"],
    "explanation": "Incidents include failed jobs, stale data, outages, security events, or quality failures that affect users or business processes.",
    "ideal_answer": "An incident is an unplanned production event that affects or threatens a service, dataset, or business process.",
    "tags": ["production_engineering", "incident_management", "operations"]
  },
  {
    "id": "production_engineering_beginner_match_007",
    "domain": "Production Engineering",
    "level": "Beginner",
    "type": "match",
    "difficulty": "easy",
    "concept": "SRE fundamentals",
    "question": "Match each SRE term to its meaning.",
    "left_items": ["SLI", "SLO", "Error budget"],
    "right_items": ["Metric that measures service behavior", "Target reliability level", "Allowed unreliability before action"],
    "correct_pairs": {"SLI": "Metric that measures service behavior", "SLO": "Target reliability level", "Error budget": "Allowed unreliability before action"},
    "explanation": "SLIs measure behavior, SLOs define targets, and error budgets help balance reliability with change velocity.",
    "ideal_answer": "An SLI is a reliability metric, an SLO is the target for that metric, and an error budget is the allowed gap before reliability work takes priority.",
    "tags": ["production_engineering", "sre", "sli", "slo", "error_budget"]
  },
  {
    "id": "production_engineering_beginner_mcq_008",
    "domain": "Production Engineering",
    "level": "Beginner",
    "type": "mcq",
    "difficulty": "easy",
    "concept": "Runbooks",
    "question": "What is a runbook?",
    "options": ["A documented procedure for operating or recovering a system", "A type of dashboard chart", "A database storage format", "A cloud billing account"],
    "correct_answer": "A documented procedure for operating or recovering a system",
    "explanation": "Runbooks guide engineers through common operational tasks, incident response, recovery, and escalation.",
    "ideal_answer": "A runbook is a documented set of steps for handling operational tasks or incidents consistently.",
    "tags": ["production_engineering", "runbooks", "incident_management", "operations"]
  },
  {
    "id": "production_engineering_beginner_fill_009",
    "domain": "Production Engineering",
    "level": "Beginner",
    "type": "fill_blank",
    "difficulty": "easy",
    "concept": "Rollback strategy",
    "question": "Fill in the blank: A ____ strategy helps restore a previous working version after a bad release.",
    "correct_answer": "rollback",
    "acceptable_answers": ["rollback", "roll back", "rollback plan", "revert"],
    "explanation": "Rollback strategies reduce production risk by allowing teams to restore a known good state after a failed change.",
    "ideal_answer": "A rollback strategy defines how to return to a previous working version if a release causes problems.",
    "tags": ["production_engineering", "rollback", "release_management", "change_management"]
  },
  {
    "id": "production_engineering_beginner_match_010",
    "domain": "Production Engineering",
    "level": "Beginner",
    "type": "match",
    "difficulty": "easy",
    "concept": "Operational responsibilities",
    "question": "Match each operational activity to its purpose.",
    "left_items": ["On-call", "Escalation", "Post-incident review"],
    "right_items": ["Responds to urgent production issues", "Gets help from the right owner", "Learns from an incident"],
    "correct_pairs": {"On-call": "Responds to urgent production issues", "Escalation": "Gets help from the right owner", "Post-incident review": "Learns from an incident"},
    "explanation": "Production support uses on-call response, escalation, and learning loops to keep systems reliable.",
    "ideal_answer": "On-call handles urgent issues, escalation brings in the right expertise, and post-incident review captures improvements.",
    "tags": ["production_engineering", "on_call", "escalation", "postmortem"]
  }
]
