[
  {
    "id": "databricks_beginner_mcq_001",
    "domain": "Databricks",
    "level": "Beginner",
    "type": "mcq",
    "difficulty": "easy",
    "concept": "Spark fundamentals",
    "question": "What is Apache Spark commonly used for in data engineering?",
    "options": ["Distributed processing of large datasets", "Managing DNS records", "Designing UI mockups", "Replacing all databases"],
    "correct_answer": "Distributed processing of large datasets",
    "explanation": "Spark distributes data processing across a cluster, making it useful for large-scale ETL, analytics, and streaming workloads.",
    "ideal_answer": "Spark is used to process large datasets in parallel across a cluster for ETL, analytics, and streaming use cases.",
    "tags": ["databricks", "spark", "distributed_processing", "basics"]
  },
  {
    "id": "databricks_beginner_mcq_002",
    "domain": "Databricks",
    "level": "Beginner",
    "type": "mcq",
    "difficulty": "easy",
    "concept": "DataFrames",
    "question": "In Spark, what is a DataFrame?",
    "options": ["A distributed table-like dataset with rows and columns", "A password store", "A cluster billing page", "A file compression format only"],
    "correct_answer": "A distributed table-like dataset with rows and columns",
    "explanation": "Spark DataFrames represent structured data and allow transformations using SQL-like operations across distributed data.",
    "ideal_answer": "A Spark DataFrame is a distributed table-like dataset with rows, columns, and schema-aware operations.",
    "tags": ["databricks", "spark", "dataframes", "basics"]
  },
  {
    "id": "databricks_beginner_fill_003",
    "domain": "Databricks",
    "level": "Beginner",
    "type": "fill_blank",
    "difficulty": "easy",
    "concept": "Delta Lake",
    "question": "Fill in the blank: ____ Lake adds reliability features such as ACID transactions to data lake tables.",
    "correct_answer": "Delta",
    "acceptable_answers": ["delta", "Delta", "Delta Lake", "delta lake"],
    "explanation": "Delta Lake adds transaction logs, ACID semantics, schema enforcement, and time travel capabilities on top of data lake storage.",
    "ideal_answer": "Delta Lake adds ACID transactions and table reliability features to data stored in cloud object storage.",
    "tags": ["databricks", "delta_lake", "acid", "basics"]
  },
  {
    "id": "databricks_beginner_match_004",
    "domain": "Databricks",
    "level": "Beginner",
    "type": "match",
    "difficulty": "easy",
    "concept": "Medallion architecture",
    "question": "Match each medallion layer to its usual purpose.",
    "left_items": ["Bronze", "Silver", "Gold"],
    "right_items": ["Raw or source-like data", "Cleaned and conformed data", "Business-ready data"],
    "correct_pairs": {"Bronze": "Raw or source-like data", "Silver": "Cleaned and conformed data", "Gold": "Business-ready data"},
    "explanation": "The medallion architecture organizes data by increasing quality and business readiness.",
    "ideal_answer": "Bronze stores raw data, Silver stores cleaned and conformed data, and Gold stores business-ready curated data.",
    "tags": ["databricks", "medallion", "bronze", "silver", "gold"]
  },
  {
    "id": "databricks_beginner_mcq_005",
    "domain": "Databricks",
    "level": "Beginner",
    "type": "mcq",
    "difficulty": "easy",
    "concept": "Delta Tables",
    "question": "What is a Delta table?",
    "options": ["A table backed by Delta Lake transaction metadata and data files", "A dashboard widget", "A network firewall rule", "A type of user account"],
    "correct_answer": "A table backed by Delta Lake transaction metadata and data files",
    "explanation": "Delta tables use data files plus a Delta transaction log to provide reliable table behavior on a data lake.",
    "ideal_answer": "A Delta table is a data lake table that uses Delta Lake metadata and files to support reliable reads and writes.",
    "tags": ["databricks", "delta_tables", "delta_lake", "tables"]
  },
  {
    "id": "databricks_beginner_fill_006",
    "domain": "Databricks",
    "level": "Beginner",
    "type": "fill_blank",
    "difficulty": "easy",
    "concept": "Unity Catalog",
    "question": "Fill in the blank: ____ Catalog provides centralized governance for data and AI assets in Databricks.",
    "correct_answer": "Unity",
    "acceptable_answers": ["unity", "Unity", "Unity Catalog", "unity catalog"],
    "explanation": "Unity Catalog provides centralized metadata, permissions, lineage, and governance across Databricks workspaces.",
    "ideal_answer": "Unity Catalog is Databricks' centralized governance layer for catalogs, schemas, tables, permissions, and lineage.",
    "tags": ["databricks", "unity_catalog", "governance", "metadata"]
  },
  {
    "id": "databricks_beginner_match_007",
    "domain": "Databricks",
    "level": "Beginner",
    "type": "match",
    "difficulty": "easy",
    "concept": "Databricks compute types",
    "question": "Match each compute type to a common use.",
    "left_items": ["Interactive cluster", "Job cluster", "SQL warehouse"],
    "right_items": ["Notebook exploration", "Automated job run", "SQL analytics queries"],
    "correct_pairs": {"Interactive cluster": "Notebook exploration", "Job cluster": "Automated job run", "SQL warehouse": "SQL analytics queries"},
    "explanation": "Databricks offers different compute options for development, scheduled jobs, and SQL workloads.",
    "ideal_answer": "Interactive clusters are useful for exploration, job clusters are used for scheduled jobs, and SQL warehouses serve SQL analytics.",
    "tags": ["databricks", "clusters", "job_clusters", "sql_warehouse"]
  },
  {
    "id": "databricks_beginner_mcq_008",
    "domain": "Databricks",
    "level": "Beginner",
    "type": "mcq",
    "difficulty": "easy",
    "concept": "Auto Loader",
    "question": "What is Auto Loader commonly used for?",
    "options": ["Incrementally ingesting new files from cloud storage", "Manually resizing a laptop", "Creating DNS zones", "Replacing all streaming systems"],
    "correct_answer": "Incrementally ingesting new files from cloud storage",
    "explanation": "Auto Loader incrementally discovers and processes new files arriving in cloud storage.",
    "ideal_answer": "Auto Loader is used to incrementally ingest new files from cloud storage into Delta tables.",
    "tags": ["databricks", "auto_loader", "ingestion", "cloud_storage"]
  },
  {
    "id": "databricks_beginner_fill_009",
    "domain": "Databricks",
    "level": "Beginner",
    "type": "fill_blank",
    "difficulty": "easy",
    "concept": "Structured Streaming",
    "question": "Fill in the blank: Spark ____ Streaming processes continuous data using the DataFrame API.",
    "correct_answer": "Structured",
    "acceptable_answers": ["structured", "Structured", "Structured Streaming", "spark structured streaming"],
    "explanation": "Structured Streaming lets Spark process streaming data using a structured DataFrame-based model.",
    "ideal_answer": "Structured Streaming processes continuous data streams using Spark's DataFrame and SQL APIs.",
    "tags": ["databricks", "structured_streaming", "spark", "streaming"]
  },
  {
    "id": "databricks_beginner_match_010",
    "domain": "Databricks",
    "level": "Beginner",
    "type": "match",
    "difficulty": "easy",
    "concept": "Catalog hierarchy",
    "question": "Match each Unity Catalog object to its role.",
    "left_items": ["Catalog", "Schema", "Table"],
    "right_items": ["Top-level container", "Namespace within a catalog", "Queryable dataset"],
    "correct_pairs": {"Catalog": "Top-level container", "Schema": "Namespace within a catalog", "Table": "Queryable dataset"},
    "explanation": "Unity Catalog organizes data using a hierarchy of catalogs, schemas, and tables.",
    "ideal_answer": "A catalog is the top-level container, a schema groups objects inside a catalog, and a table is the queryable dataset.",
    "tags": ["databricks", "unity_catalog", "catalogs", "schemas", "tables"]
  }
]
